{
  "$schema": "https://json-schema.org/draft/2020-12/schema",
  "$id": "https://sva.hypd.asia/contracts/catalog-release.schema.json",
  "title": "WBU Catalog Release",
  "type": "object",
  "additionalProperties": false,
  "required": [
    "schema_version",
    "release_id",
    "generated_at",
    "producer",
    "sources",
    "files"
  ],
  "properties": {
    "schema_version": {
      "const": 1
    },
    "release_id": {
      "type": "string",
      "pattern": "^sha256:[0-9a-f]{64}$"
    },
    "generated_at": {
      "type": "string",
      "format": "date-time"
    },
    "producer": {
      "type": "object",
      "additionalProperties": false,
      "required": ["name", "version"],
      "properties": {
        "name": {
          "type": "string",
          "minLength": 1
        },
        "version": {
          "type": "string",
          "minLength": 1
        }
      }
    },
    "sources": {
      "type": "array",
      "items": {
        "$ref": "#/$defs/source"
      }
    },
    "files": {
      "type": "array",
      "minItems": 1,
      "uniqueItems": true,
      "items": {
        "$ref": "#/$defs/file"
      }
    }
  },
  "$defs": {
    "source": {
      "type": "object",
      "additionalProperties": false,
      "required": ["kind", "name", "reference"],
      "properties": {
        "kind": {
          "enum": [
            "game_resources",
            "runtime_profile",
            "official_api",
            "manual",
            "generated"
          ]
        },
        "name": {
          "type": "string",
          "minLength": 1
        },
        "reference": {
          "type": "string",
          "minLength": 1
        }
      }
    },
    "file": {
      "type": "object",
      "additionalProperties": false,
      "required": ["path", "object", "size", "sha256"],
      "properties": {
        "path": {
          "type": "string",
          "pattern": "^data/(?!wbcapture/)(?:[^/]+/)*[^/]+$"
        },
        "object": {
          "type": "string",
          "pattern": "^[0-9a-f]{2}/[0-9a-f]{64}(\\.[A-Za-z0-9]{1,16})?$"
        },
        "size": {
          "type": "integer",
          "minimum": 0
        },
        "sha256": {
          "type": "string",
          "pattern": "^[0-9a-f]{64}$"
        }
      }
    }
  }
}
